CVEDescription,Characterization
ssl proxi featur srx devic fail handl hardwar resourc limit exploit remot ssl tl server crash flowd daemon repeat crash flowd daemon result extend denial servic condit issu occur client srx devic initi connect malici server issu affect junip network juno os srx seri version prior version prior version prior version prior version prior version prior version prior version prior version prior ,Channel
improp restrict commun channel intend endpoint vulner http daemon synolog ssl vpn client allow remot attack conduct man middl attack craft payload ,Channel
philip alert unit non medic devic version prior softwar transmit sensit secur critic data cleartext commun channel snif unauthor actor philip alert commun channel encrypt lead disclosur person contact inform applic login credenti subnet ,Channel
elev privileg vulner exist window hyper instruct emul fail properli enforc privileg level aka hypervisor code integr elev privileg vulner affect window server window window server ,Hypervisor
quick emul aka qemu built cirru clgd xx vga emul support allow local guest os privileg user caus denial servic bound access qemu process crash leverag incorrect region calcul updat vga displai ,Guest OS
net iq ident manag commun channel version prior suscept attack ,Channel
load multiboot function hw multiboot quick emul aka qemu allow local guest os user execut arbitrari code qemu host mh load end addr valu greater mh bss end addr trigger bound read write memori access ,Guest OS
issu discov xen allow pvh guest os user caus denial servic pointer derefer hypervisor crash leverag mishandl configur lack local apic ,Hypervisor
issu discov xen allow guest os user caus denial servic hypervisor crash gain privileg trigger grant tabl transit ,Hypervisor
ffxivlaunch ex squar enix fantasi xiv window affect improp enforc messag integr transmiss commun channel allow man middl attack steal user credenti session retriev global js http proceed us http fix patch ,Channel
util virlog libvirt doe properli determin hostnam lxc contain startup allow local guest os user bypass intend contain protect mechan execut arbitrari command craft nss modul ,Guest OS
maskin dcu rp marin pro observ android app transmit sensit secur critic data cleartext commun channel snif unauthor actor devic transmit process control inform unencrypt modbu commun impact attack exploit vulner observ inform configur set sensor present us inform aid craft spoof messag requir access network affect releas maskin dcu rp marin pro observ android app version prior arm ,Channel
xen infrastructur introduc overhaul msr emul happen guest unfortun track structur isn freed vcpu destroi allow guest os administr caus denial servic host os memori consumpt reboot time ,Guest OS
vulner identifi siveil vm video android version siveil vm video os version improp certif valid allow attack privileg network posit read data write data encrypt commun channel app server secur vulner exploit attack privileg network posit allow intercept commun channel affect app server man middl furthermor attack abl gener certif result valid algorithm checksum ident trust certif success exploit requir user interact vulner allow read data write data encrypt commun channel app server impact commun confidenti integr time advisori public exploit secur vulner known siemen confirm secur vulner provid mitig resolv secur issu ,Channel
issu discov certain appl product mac os affect issu involv hypervisor compon allow attack execut arbitrari code privileg context caus denial servic memori corrupt craft app ,Hypervisor
system microprocessor util specul execut address translat allow unauthor disclosur inform resid data cach attack local user access guest os privileg termin page fault channel analysi ,Guest OS
hw rdma rdma backend qemu allow guest os user trigger bound access pvrdma sq wqe ring element larg num sge valu ,Guest OS
issu discov xen intel platform allow guest os user caus denial servic host os hang xen doe work intel mishandl certain hle transact associ kacquir instruct prefix ,Guest OS
issu discov xen allow pv guest os user caus denial servic host os crash possibl gain host os privileg interpret conflict data structur associ shadow page note issu exist incorrect fix cve ,Guest OS
issu discov xen allow bit pv guest os user caus denial servic host os crash gp occur non canon address pass tlb flush code note issu exist incorrect cve aka meltdown mitig ,Guest OS
issu discov xen allow guest os user caus denial servic host os hang lock remain unavail indefinit certain error condit ,Guest OS
issu discov xen allow hvm guest os user caus denial servic host os crash possibl gain host os privileg ioreq server resourc account extern emul mishandl ,Guest OS
arm mbed tl allow local unprivileg attack recov plaintext rsa decrypt us rsa ec dh cipher suit ,Channel
arch arm kvm guest kvm linux kernel arm platform mishandl kvm set reg ioctl exploit attack creat machin attack arbitrarili redirect hypervisor flow control control attack caus denial servic hypervisor panic illeg except occur insuffici restrict userspac access core file pstate valid doe prevent unintend execut mode ,Hypervisor
us free issu wai linux kernel kvm hypervisor process post interrupt nest virtual enabl nest vmc page error process post interrupt address unmap pi desc page reset pi desc descriptor address later us pi test clear guest user process us flaw crash host kernel result potenti gain privileg access kernel version vulner ,Hypervisor
ibm big fix platform transmit sensit secur critic data clear text commun channel snif unauthor actor ibm forc id ,Channel
issu discov xen arm properli implement grant tabl hypervisor linux unfortun arm guest request grant tabl simpli properli set result subsequ grant relat hypercal hit bug check unprivileg guest caus bug check hypervisor result denial servic crash ,Hypervisor
vulner cryptograph hardwar acceler driver cisco adapt secur applianc asa softwar cisco firepow threat defens ftd softwar allow unauthent remot attack caus affect devic reload result temporari denial servic condit vulner exist affect devic limit direct memori access dma memori affect softwar improperli handl resourc low memori condit attack exploit vulner send sustain high rate malici traffic affect devic exhaust memori devic success exploit allow attack exhaust dma memori affect devic caus devic reload result temporari condit ,Physical Hardware
issu discov linux kernel us xen xen failsaf callback entri point arch entri entri doe properli maintain rbx allow local user caus denial servic uniniti memori usag crash xen bit pv linux guest os user trigger guest os crash possibl gain privileg ,Guest OS
live migrat instanc briefli abl inspect traffic instanc hypervisor brief window extend indefinit instanc port set administr prior live migrat kept migrat complet possibl open integr bridg connect instanc migrat connect integr bridg traffic instanc open instanc potenti visibl migrat guest requir open vlan filter appli post migrat version openstack neutron vulner ,Hypervisor
tp link tl wa wi fi rang extend hardwar version allow remot attack caus denial servic reboot data reboot json ,Physical Hardware
stack base buffer overflow tp link tl wa wi fi rang extend hardwar version allow remot authent user caus denial servic outag type paramet data syslog filter json ,Physical Hardware
simpli safe origin unencrypt sensor transmiss allow physic proxim attack obtain potenti sensit inform specif time alarm event occur ,Channel
issu discov xen allow hvm guest os user caus denial servic unexpectedli high interrupt number arrai overrun hypervisor crash possibl gain hypervisor privileg set hpet timer deliv interrupt io apic mode aka hpet interrupt inject ,Hypervisor
kernel kvm version kernel kernel rc kernel rc kernel rc kernel rc vulner flaw wai linux kernel kvm hypervisor handl except deliv stack oper mov ss pop ss instruct stack oper processor did deliv interrupt except deliv instruct stack execut unprivileg kvm guest user us flaw crash guest potenti escal privileg guest ,Hypervisor
flaw wai linux kernel kvm hypervisor emul instruct sgdt sidt fxsave fxrstor did check current privileg cpl level emul unprivileg instruct unprivileg guest user process us flaw potenti escal privileg insid guest ,Hypervisor
issu discov xen allow pv guest os user caus denial servic bound zero write hypervisor crash unexpect process incorrect fix cve ,Hypervisor
hardwar vulner gpu memori modul allow attack acceler micro architectur attack us java script web gl api ,Physical Hardware
vulner simpl network manag protocol snmp subsystem commun channel cisco seri stackabl manag switch allow authent remot attack caus devic reload unexpectedli caus denial servic condit devic nai need manual reload recov vulner lack proper input throttl ingress snmp traffic intern attack exploit vulner send craft heavi stream snmp traffic target devic exploit allow attack caus devic reload unexpectedli caus condit cisco bug id csc vg ,Channel
disput issu discov sma solar technolog product sip implement doe properli us authent encrypt vulner replai attack packet inject attack man middl attack attack abl successfulli us sip commun devic lan attack us crash devic stop commun sma server exploit known sip vulner sensit inform sip commun furthermor sip commun channel unencrypt attack capabl understand protocol eavesdrop commun exampl password extract note vendor posit authent encrypt requir isol subnetwork sunni boi tlst tl sunni tripow tl tl potenti affect ,Channel
disput issu discov sma solar technolog product sma data commun protocol doe properli us authent encrypt vulner man middl packet inject replai attack set chang authent packet scout packet replai inject us man middl session function avail sunni explor effect network attack get packet setup correctli includ authent process includ hidden access level chang set accord gain access right furthermor sma data commun channel unencrypt attack capabl understand protocol eavesdrop commun note vendor posit authent encrypt requir isol subnetwork sunni boi tlst tl sunni tripow tl tl potenti affect ,Channel
inadequ encrypt strength issu discov mirion technolog dmc transmitt modul pam transmitt dmc rd tx variant includ rsd drm variant includ solar pwr drm rd base boundari monitor extern transmitt telepol ii mesh repeat telemetri enabl devic decrypt data possibl hardwar level ,Physical Hardware
qemu aka quick emul built mega raid sa em host bu adapt emul support allow local guest os privileg user caus denial servic pointer derefer qemu process crash vector involv megasa command process ,Guest OS
qemu aka quick emul built usb hci control emul support allow local guest os privileg user caus denial servic infinit recurs vector involv control transfer descriptor sequenc ,Guest OS
memori leak qemu aka quick emul built usb ehci emul support allow local guest os privileg user caus denial servic memori consumpt repeatedli hot unplug devic ,Guest OS
memori leak qemu aka quick emul built id ahci emul support allow local guest os privileg user caus denial servic memori consumpt repeatedli hot unplug ahci devic ,Guest OS
qemu aka quick emul built usb ohci emul support allow local guest os user caus denial servic infinit loop leverag incorrect valu differ vulner cve ,Guest OS
issu known xsa discov xen fix avail earlier xsa fix introduc insuffici check xenmem exchang input allow caller drive hypervisor memori access outsid guest provid input output arrai ,Hypervisor
vulner web proxi function cisco web secur applianc wsa allow unauthent remot attack forward traffic web proxi affect devic administr manag affect devic aka access control bypass vulner affect product hardwar version cisco web secur applianc wsa inform csc vd known affect releas ,Physical Hardware
man middl issu discov hyundai motor america blue link commun channel endpoint verifi allow remot attack access influenc commun identifi endpoint ,Channel
json viewer develop tool us insecur method creat commun channel copi view json http header data allow potenti privileg escal vulner affect thunderbird firefox esr firefox ,Channel
ssh configur rapid nexpos hardwar applianc ship june doe specifi desir algorithm kei exchang import function result fall allow algorithm support relev version open ssh make instal vulner rang mitm downgrad decrypt attack ,Physical Hardware
issu discov st jude medic merlin home version prior version rf model ex induct model ex induct model ex merlin demand capabl ident endpoint commun channel transmitt st jude medic web site merlin net verifi allow man middl attack access influenc commun identifi endpoint ,Channel
vulner url filter featur cisco async os softwar cisco web secur applianc wsa allow unauthent remot attack bypass configur url filter rule affect product vulner affect releas prior fix releas cisco async os softwar cisco web secur applianc wsa hardwar applianc configur url filter email scan inform csc vc known affect releas ,Physical Hardware
vulner multipurpos internet mail extens mime scanner cisco async os softwar cisco email secur applianc esa allow unauthent remot attack bypass configur user filter devic aka malform mime header filter bypass vulner affect releas prior fix releas cisco async os softwar cisco email secur applianc hardwar applianc softwar configur appli messag filter content filter incom email attach inform csc vb known affect releas known fix releas ,Physical Hardware
vulner content scan engin cisco async os softwar cisco email secur applianc esa allow unauthent remot attack bypass configur messag content filter devic affect product vulner affect releas prior fix releas cisco async os softwar cisco email secur applianc hardwar applianc softwar configur appli messag filter content filter incom email attach vulner limit specif rule action messag filter content filter inform csc uz known affect releas hp known fix releas ,Physical Hardware
load segment descriptor implement arch kvm emul linux kernel improperli emul mov ss selector instruct allow guest os user caus denial servic guest os crash gain guest os privileg craft applic ,Guest OS
issu discov certain appl product mac os affect issu involv hypervisor compon allow guest os user obtain sensit inform cr control unspecifi vector ,Hypervisor
issu discov softwar vaultek gun safe vt product encrypt session android applic safe websit market materi advertis commun channel encrypt highest level bluetooth encrypt data transmiss secur ae bit encrypt claim true ae bit encrypt support bluetooth low energi ble standard applic level lack encrypt allow individu learn passcod eavesdrop commun applic safe ,Channel
hardwar secur modul mate mate pro huawei smart phone version earlier mha al bc version earlier mha cl bc version earlier mha dl bc version earlier mha tl bc version earlier lon al bc version earlier lon cl bc version earlier lon dl bc version earlier lon tl bc arbitrari memori read write vulner input paramet valid attack root privileg android exploit vulner read write memori data execut arbitrari code trust zone ,Physical Hardware
issu discov filter schedul open stack nova repeatedli rebuild instanc imag authent user consum untrack resourc hypervisor host lead denial servic aka doubl resourc alloc regress introduc fix ossa cve nova stabl pike later deploy fix appli reli filter schedul affect ,Hypervisor
issu discov xen grant copi code implic grant pin accompani suitabl page refer portion code did match assumpt grant copi oper grant dy domain assumpt turn wrong malici guest administr caus hypervisor memori corrupt like result host crash denial servic privileg escal inform leak rule ,Hypervisor
issu discov xen allow pv guest os user caus denial servic unbound recurs stack consumpt hypervisor crash possibl gain privileg craft page tabl stack ,Hypervisor
issu discov xen allow svm pv guest os user caus denial servic hypervisor crash gain privileg idt set mishandl cpu hotplug ,Hypervisor
issu discov xen allow hvm guest os user caus denial servic hypervisor crash possibl gain privileg self linear shadow map mishandl translat guest ,Hypervisor
issu discov xen allow guest os user caus denial servic hypervisor crash possibl gain privileg msi map mishandl ,Hypervisor
issu discov xen allow hvm guest os user obtain sensit inform host os arbitrari guest os intercept oper caus write data uniniti hypervisor stack memori ,Hypervisor
tp link tl wr tl wr nd wireless lite router firmwar version build rel hardwar version wr paramet ssid wireless set properli valid possibl inject malici code script bug script href xxx com second payload block chang wireless set factori reset requir ,Physical Hardware
multipl stack base buffer overflow tp link wr wi fi router hardwar version allow remot authent user execut arbitrari code ping addr paramet ping ifram rpm htm dnsserver paramet wan ip cfg rpm htm ,Physical Hardware
hardwar hevc decod media file caus page fault lead remot denial servic critic process addit execut privileg need user interact need exploit product android version android kernel android id ,Physical Hardware
servic manag add function hardwar servic manag insecur permiss check base pid caller allow applic servic replac hal servic servic lead local elev privileg enabl code execut privileg process addit execut privileg need user interact need exploit product android version android id ,Physical Hardware
ieee standard describ flaw method encrypt electron design intellectu properti ip manag access right ip includ modif encrypt kei insert hardwar trojan ip method flaw egregi case enabl attack vector allow recoveri entir underli plaintext ip implement ieee weak cryptograph attack allow attack obtain plaintext intellectu properti kei impact ,Channel
ieee standard describ flaw method encrypt electron design intellectu properti ip manag access right ip includ modif encrypt ip cyphertext insert hardwar trojan method flaw egregi case enabl attack vector allow recoveri entir underli plaintext ip implement ieee weak cryptograph attack allow attack obtain plaintext intellectu properti kei impact ,Channel
qemu aka quick emul built id disk cd dvd rom emul support allow local guest os privileg user caus denial servic pointer derefer qemu process crash flush cdrom devic drive ,Guest OS
siemen logo soft comfort version lack integr verif softwar packag download unprotect commun channel allow remot attack manipul softwar perform man middl mit attack ,Channel
ibm web sphere mq allow authent user potenti caus denial servic save incorrect channel statu inquiri ibm forc id ,Channel
vulner cisco umbrella insight applianc earlier allow authent local attack log affect applianc root privileg vulner presenc user credenti affect applianc attack exploit vulner hypervisor consol connect local affect credenti log affect applianc success exploit allow attack log affect applianc root privileg cisco bug id csc vg ,Hypervisor
ibm tivoli endpoint manag ibm big fix platform transmit sensit secur critic data cleartext commun channel snif unauthor actor ibm forc id ,Channel
vulner rom monitor rommon code cisco ir integr servic router softwar allow unauthent local attack boot hypervisor affect devic compromis integr vulner insuffici sanit user input attack access affect router consol exploit vulner enter rommon mode modifi rommon variabl success exploit allow attack execut arbitrari code instal malici version hypervisor firmwar affect devic cisco bug id csc vb ,Hypervisor
xen doe valid cpu arrai index send sgi allow guest os user caus denial servic hypervisor crash aka xsa ,Hypervisor
xen mishandl interrupt inject allow guest os user caus denial servic hypervisor crash aka xsa ,Hypervisor
vers firmwar arri nvg nvg unspecifi devic ip passthrough mode us configur sbdc ha wan tcp servic port bdctest account bdctest password allow remot attack obtain sensit inform wi fi password leverag knowledg hardwar identifi relat bulk data collect bdc mechan defin broadband forum technic report ,Firmware
vulner oracl outsid technolog compon oracl fusion middlewar subcompon outsid filter support version affect easili exploit vulner allow low privileg attack access physic commun segment attach hardwar oracl outsid technolog execut compromis oracl outsid technolog success attack vulner result unauthor abil caus hang frequent repeat crash complet do oracl outsid technolog note outsid technolog suit softwar develop kit sdk protocol cvss score depend softwar us outsid technolog code cvss score assum softwar pass data receiv network directli outsid technolog code data receiv network cvss score lower cvss base score avail impact cvss vector cvss av ac pr ui ,Physical Hardware
kvm subsystem linux kernel allow guest os user caus denial servic assert failur hypervisor hang crash bound guest irq valu relat arch kvm vmx virt kvm eventfd ,Hypervisor
window hyper microsoft window server sp sp window sp window window server gold window rt window gold window server allow attack gain elev privileg target guest oper window hyper instruct emul fail properli enforc privileg level aka hypervisor code integr elev privileg vulner ,Hypervisor
hyper microsoft window vista sp window server sp window sp window window server gold window gold window server allow guest os user run machin caus denial servic craft applic aka hyper denial servic vulner vulner differ describ cve cve cve cve ,Guest OS
hyper microsoft window gold window server allow guest os user run machin caus denial servic craft applic aka hyper denial servic vulner vulner differ describ cve cve cve cve ,Guest OS
cirru copi function hw displai cirru vga qemu aka quick emul cirru graphic mode vga allow local guest os privileg user caus denial servic divid zero error qemu process crash vector involv blit pitch valu ,Guest OS
ioport read ioport write function xen qemu us devic model xen allow local hvm guest os administr gain qemu process privileg vector involv rang ioport access ,Guest OS
arch kvm vmx linux kernel mismanag bp except allow guest os user caus denial servic guest os crash declin handl except thrown guest ,Guest OS
xen run bit hypervisor allow local guest os user modifi arbitrari memori consequ obtain sensit inform caus denial servic host crash execut arbitrari code host leverag broken emul bit test instruct ,Hypervisor
xen mishandl task switch vm mode allow local bit hvm guest os user gain privileg caus denial servic guest os crash leverag guest oper us hardwar task switch allow task start vm mode ,Guest OS
race condit qemu xen allow local hvm guest os administr gain privileg chang certain data share ring aka fetch vulner ,Guest OS
memori leak fs write function hw pf qemu aka quick emul allow local guest os administr caus denial servic memori consumpt leverag failur free io vector ,Guest OS
memori leak fs link function hw pf qemu aka quick emul allow local guest os administr caus denial servic memori consumpt vector involv refer sourc fid ,Guest OS
multipl integ overflow fs xattr read fs xattr write function hw pf qemu aka quick emul allow local guest os administr caus denial servic qemu process crash craft offset trigger bound access ,Guest OS
fs xattrcreat function hw pf qemu aka quick emul allow local guest os administr obtain sensit host heap memori inform read xattribut valu write ,Guest OS
memori leak fs xattrcreat function hw pf qemu aka quick emul allow local guest os administr caus denial servic memori consumpt qemu process crash larg number txattrcreat messag fid number ,Guest OS
memori leak hw net eepro qemu aka quick emul allow local guest os administr caus denial servic memori consumpt qemu process crash repeatedli unplug pro nic devic ,Guest OS
possibl unauthor memori access hypervisor incorrect configur provid access subsystem page tabl product android version kernel android id refer qc cr ,Hypervisor
possibl unauthor memori access hypervisor lack input valid allow hypervisor memori access hlo product android version kernel android id qc cr ,Hypervisor
possibl buffer overflow hypervisor inappropri usag arrai lead buffer overrun product android version kernel android id refer qc cr ,Hypervisor
possibl buffer overflow smmu improp input valid adsp sid cb result hypervisor memori overwrit product android version kernel android id refer qc cr ,Hypervisor
integ overflow lead toctou condit hypervisor pil integ overflow expos race condit us bypass peripher imag loader pil authent product android version kernel android id refer qc cr ,Hypervisor
xen earlier doe properli honor cr ts cr em allow local hvm guest os user read modifi fpu mmx xmm state inform belong arbitrari task guest modifi instruct hypervisor prepar emul ,Hypervisor
cross site script xss vulner host client vm ware sphere hypervisor aka esx allow remot authent user inject arbitrari web script html craft vm ,Hypervisor
virtqueu map desc function hw virtio virtio qemu aka quick emul allow local guest os administr caus denial servic pointer derefer qemu process crash larg descriptor buffer length valu ,Guest OS
pvscsi ring pop req descr function hw scsi vmw pvscsi qemu aka quick emul allow local guest os administr caus denial servic infinit loop qemu process crash leverag failur limit process io loop ring ,Guest OS
xen allow local hvm guest os administr overwrit hypervisor memori consequ gain host os privileg leverag mishandl instruct pointer truncat emul ,Hypervisor
integ overflow net tx pkt init function hw net net tx pkt qemu aka quick emul allow local guest os administr caus denial servic qemu process crash maximum fragment count trigger uncheck multipl pointer derefer ,Guest OS
vmxnet tx pkt pars header function hw net vmxnet tx pkt qemu aka quick emul allow local guest os administr caus denial servic buffer read leverag failur check ip header length ,Guest OS
net tx pkt sw fragment function hw net net tx pkt qemu aka quick emul allow local guest os administr caus denial servic infinit loop qemu process crash zero length current fragment length ,Guest OS
