CVEDescription,Characterization
xen implement supervisor mode access prevent smap whitelist bit except event deliveri allow local bit pv guest os kernel caus denial servic hypervisor vm crash trigger safeti check ,Hypervisor
arch powerpc kvm book hv rmhandler linux kernel power pc platform config kvm book hv enabl allow guest os user caus denial servic host os infinit loop make cede hypercal exist suspend transact ,Hypervisor
cmd function hw scsi esp qemu allow local guest os administr caus denial servic bound write qemu process crash vector relat read inform transfer buffer non dma mode ,Guest OS
qemu aka quick emul built vmware pvscsi paravirtu scsi bu emul support allow local guest os administr caus denial servic bound arrai access vector relat pvscsi cmd setup ring pvscsi cmd setup msg ring scsi command ,Guest OS
esp reg write function hw scsi esp fast scsi control fsc support qemu doe properli check command buffer length allow local guest os administr caus denial servic bound write qemu process crash potenti execut arbitrari code qemu host unspecifi vector ,Guest OS
ehci advanc state function hw usb hcd ehci qemu allow local guest os administr caus denial servic infinit loop cpu consumpt circular split isochron transfer descriptor si td list relat issu cve ,Guest OS
msr mtrr valid function arch kvm mtrr linux kernel support msr allow guest os user read write kvm arch vcpu data structur consequ obtain sensit inform caus denial servic crash craft ioctl ,Guest OS
fpu fxrstor function arch xen doe properli handl write hardwar fsw es bit run amd processor allow local guest os user obtain sensit content inform guest leverag pend except mask bit note vulner exist incorrect fix cve ,Guest OS
function arch kernel process linux kernel doe properli context iopl bit pv xen guest allow local guest os user gain privileg caus denial servic guest os crash obtain sensit inform leverag port access ,Guest OS
rndi function usb net devic emul hw usb dev network qemu doe properli valid usb configur descriptor object allow local guest os administr caus denial servic pointer derefer qemu process crash vector involv remot ndi control messag packet ,Guest OS
integ overflow bhyve hypervisor free bsd configur larg guest memori allow local user gain privileg craft devic descriptor ,Hypervisor
fw cfg write fw cfg read function hw nvram fw cfg qemu built firmwar configur devic emul support allow guest os user cap sy rawio privileg caus denial servic bound read write access process crash possibl execut arbitrari code invalid current entri valu firmwar configur ,Guest OS
page invlpg function includ page xen shadow mode page nest virtual enabl allow local hvm guest user caus denial servic host crash non canon guest address invvpid instruct trigger hypervisor bug check ,Hypervisor
pv superpag function arch mm xen allow local pv guest obtain sensit inform caus denial servic gain privileg unspecifi impact craft page identifi mfn mmuext mark mmuext unmark sub op hypervisor mmuext op hypercal unknown vector relat page tabl updat ,Hypervisor
us free vulner hw id ahci qemu built id ahci emul support allow guest os user caus denial servic instanc crash possibl execut arbitrari code invalid ahci command queu ncq aio command ,Guest OS
cisco nexu applic av devic sv allow remot attack caus denial servic esx hypervisor crash purpl screen craft cisco discoveri protocol packet trigger bound memori access aka bug id csc uw ,Hypervisor
issu discov mattermost server doe ensur cooki us ssl ,Channel
certain netgear devic affect insecur renegoti affect srx fv gv fv fv gv ,Channel
imapf ilter doe valid hostnam ssl certif ,Channel
issu discov openssl crate rust ssl tl man middl vulner certif verif api hostnam verif ,Channel
android earlier secur patch level qualcomm snapdragon automobil snapdragon mobil snapdragon wear mdm mdm mdm mdm mdm mdm mdm msm sd sd sd sd sd sd sd sd sd sd sd sd sd sd sd sd sdx npa routin root pd handl resourc request remot qdi valid pointer pass user space result guest os memori corrupt ,Guest OS
qualcomm product android releas caf linux kernel argument hypervisor function properli valid ,Hypervisor
qualcomm product android releas caf linux kernel integ overflow vulner exist hypervisor ,Hypervisor
vmfunc emul xen system amd virtual extens aka svm allow local hvm guest os user caus denial servic hypervisor crash leverag miss pointer check ,Hypervisor
microsoft window gold allow local user bypass secur mode hypervisor code integr hvci protect mechan perform rwx mark kernel mode page craft applic aka hypervisor code integr secur featur bypass ,Hypervisor
android releas caf linux kernel hypervisor api misus bypass authent ,Hypervisor
hvm set callback function arch hvm irq xen doe limit number printk consol messag log callback method allow local hvm guest os user caus denial servic larg number chang callback method hvm param callback irq ,Hypervisor
ehci process itd function hw usb hcd ehci qemu allow local guest os administr caus denial servic infinit loop cpu consumpt circular isochron transfer descriptor td list ,Guest OS
xen earlier doe properli enforc limit page order input xenmem increas reserv xenmem popul physmap xenmem exchang possibl hypervisor memori op suboper allow arm guest os administr caus denial servic cpu consumpt guest reboot watchdog timeout host reboot possibl unspecifi impact unknown vector ,Hypervisor
xen doe limit number printk consol messag log certain pmu profil hypercal allow local guest caus denial servic sequenc craft hypercal xenoprof op hypercal properli handl xenoprof op function common xenoprof hypervisor xenpmu op hypercal properli handl xenpmu op function arch cpu vpmu ,Hypervisor
xen doe limit number printk consol messag report unimpl hypercal allow local guest caus denial servic sequenc hypervisor physdev op hypercal properli handl physdev op function arch arm physdev hypervisor hvm op hypercal properli handl hvm op function arch arm hvm ,Hypervisor
msi mmio support hw pci msix qemu aka quick emul allow local guest os privileg user caus denial servic pointer derefer qemu process crash leverag failur defin write method ,Guest OS
cross site script xss vulner advanc set page fortinet forti manag hardwar model hard disk forti analyz allow remot administr inject arbitrari web script html vector relat report filter ,Physical Hardware
us free vulner hypervisor appl os allow local user gain privileg vector involv vm object ,Hypervisor
vm ware tool hgf aka share folder implement vm ware workstat vm ware player vm ware fusion vm ware esx allow window guest os user gain guest os privileg caus denial servic guest os kernel memori corrupt unspecifi vector ,Guest OS
rsa crt implement cavium softwar develop kit sdk us octeon ii cn xxx hardwar linux support tl perfect forward secreci pf make easier remot attack obtain rsa kei conduct lenstra channel attack ,Channel
heap base buffer overflow spice allow guest os user read write arbitrari memori locat host guest qxl command relat surfac creation ,Guest OS
vdsm libvirt red hat enterpris virtual hypervisor aka rhev packag red hat enterpris virtual vsdm run spice disabl ticket vm suspend restor allow remot attack log authent unspecifi vector ,Hypervisor
stack base buffer overflow hw scsi scsi bu qemu built scsi devic emul support allow guest os user cap sy rawio permiss caus denial servic instanc crash invalid opcod scsi command descriptor block ,Guest OS
arrai index error tcm vhost make tpg function driver vhost scsi linux kernel allow guest os user caus denial servic memori corrupt possibl unspecifi impact craft vhost scsi set endpoint ioctl note affect function renam vhost scsi make tpg vulner announc ,Guest OS
qfx qfx platform number byte collect random interrupt entropi sourc devic boot insuffici possibl lead weak duplic ssh kei self ssl tl certif entropi increas run time immedi boot entropi low issu affect qfx qfx switch junip network product platform affect weak entropi vulner ,Channel
citrix net scaler applic deliveri control adc net scaler gatewai build build allow remot attack caus denial servic reboot unspecifi vector ,Physical Hardware
netlogon servic microsoft window server sp sp window server sp sp window server gold doe properli implement domain control commun allow remot attack discov credenti leverag certain pdc access spoof bdc role pdc commun channel aka elev privileg vulner netlogon ,Channel
hypervisor xen version hypercal xen doe properli initi data structur allow local guest user obtain sensit inform unspecifi vector ,Hypervisor
thale shield connect hardwar model allow physic proxim attack sign arbitrari data previous load sign kei extract devic identif kei kneti imperson shield connect devic network affect integr confidenti newli creat kei potenti caus unspecifi impact previous load kei connect usb port panel ,Physical Hardware
web admin red hat enterpris virtual manag rhev allow local user bypass timeout function select vm vm grid view ,Hypervisor
hypervisor appl os allow local user caus denial servic unspecifi vector ,Hypervisor
host guest file hgf vm ware workstat vm ware player vm ware fusion allow guest os user caus guest os denial servic unspecifi vector ,Guest OS
em sysent function arch kvm emul linux kernel guest os lack sysent msr initi allow guest os user gain guest os privileg caus denial servic guest os crash trigger us bit code segment emul sysent instruct ,Guest OS
hardwar vpn client viprinet multichannel vpn router version doe valid remot vpn endpoint ident check endpoint ssl kei initi exchang allow remot attack perform replai attack ,Physical Hardware
hardwar vpn client viprinet multichannel vpn router version doe valid remot vpn endpoint ident check endpoint ssl kei initi exchang allow attack perform man middl attack ,Physical Hardware
acceler support rep mov instruct xen earlier lack properli bound check memori map mmio emul hypervisor allow local hvm guest caus denial servic host crash unspecifi vector ,Hypervisor
compat mode hypercal argument translat xen run bit hypervisor allow local bit hvm guest caus denial servic host crash vector involv alter high halv regist bit mode ,Hypervisor
multipl cross site request forgeri csrf vulner compal broadband network cbn ch cg wireless gatewai hardwar firmwar ch nosh allow remot attack hijack authent administr request unspecifi impact ddn configur request basic ddn html chang wifi password ps kei paramet set wireless secur html add mac address mac address paramet add action set basic dhcp html enabl disabl paramet appli action set advanc option html ,Physical Hardware
kvm iommu map page function virt kvm iommu linux kernel miscalcul number page handl map failur allow guest os user caus denial servic host os page unpin possibl unspecifi impact leverag guest os privileg note vulner exist incorrect fix cve ,Guest OS
race condit arch kvm linux kernel allow guest os user caus denial servic guest os crash craft applic perform mmio transact pio transact trigger guest userspac emul error report similar issu cve ,Guest OS
hvm msr read intercept function arch hvm hvm xen us improp msr rang apic emul allow local hvm guest caus denial servic host crash read data hypervisor guest unspecifi vector ,Hypervisor
unauthent remot attack abl execut command view wireless account credenti store cleartext baxter sigma spectrum infus version model bax wireless batteri modul wbm version allow attack gain access host network baxter releas version sigma spectrum infus version incorpor hardwar softwar chang ,Physical Hardware
baxter sigma spectrum infus version model bax wireless batteri modul wbm version remot access port ssh authent remot attack abl make unauthor configur chang wbm issu command access account credenti share kei baxter assert vulner allow access featur function wbm sigma spectrum infus pump control wbm baxter releas version sigma spectrum infus version incorpor hardwar softwar chang ,Physical Hardware
baxter sigma spectrum infus version model bax wireless batteri modul wbm version contain hard code password provid access basic biomed inform limit devic set network configur wbm connect hard code password allow attack physic access devic access manag function make unauthor configur chang biomed set turn wireless connect phase complet audibl alarm indic end infus phase baxter releas version sigma spectrum infus version incorpor hardwar softwar chang ,Physical Hardware
xen doe properli clean memori page recov guest allow local guest os user obtain sensit inform unspecifi vector ,Hypervisor
window guest tool citrix xen server sp earlier allow remot attack caus denial servic guest os crash craft ethernet frame ,Guest OS
vm ware tool vm ware workstat vm ware player vm ware fusion vm ware esx window guest os us allow guest os user gain guest os privileg caus denial servic kernel pointer derefer guest os crash unspecifi vector ,Guest OS
arch kvm emul kvm subsystem linux kernel doe properli perform rip chang allow guest os user caus denial servic guest os crash craft applic ,Guest OS
arch kvm vmx kvm subsystem linux kernel doe exit handler invvpid instruct allow guest os user caus denial servic guest os crash craft applic ,Guest OS
duplic improp verif ssl certif ,Channel
hvmop set mem type control xen allow local guest hvm administr caus denial servic hypervisor crash possibl execut arbitrari code leverag separ qemu dm vulner trigger invalid page tabl translat unspecifi memori page type ,Hypervisor
vgic distr mmio write function guest interrupt control gic distributor arch arm vgic xen run arm allow local guest user caus denial servic pointer derefer host crash unspecifi vector ,Hypervisor
error flask secur avc cachestat function xsm flask flask op xen maximum number physic cpu us allow local user caus denial servic host crash obtain sensit inform hypervisor memori leverag flask avc cachestat hypercal trigger buffer read ,Hypervisor
irq setup xen devic passthrough configur support larg number cpu free certain memori intend us allow local guest administr caus denial servic memori corrupt hypervisor crash possibl execut arbitrari code vector relat memori error trigger us free free ,Hypervisor
ovirt engin sdk python doe verifi hostnam remot endpoint match common cn subject alt specifi certif tl ssl session allow man middl attack spoof remot endpoint arbitrari valid certif ,Channel
fenc agent doe verifi remot ssl certif fenc cisco uc py script potenti allow man middl attack spoof ssl server arbitrari ssl certif ,Channel
web cisco media sens doe properli protect client server commun channel allow remot attack obtain sensit queri cooki inform unspecifi vector aka bug id csc uj ,Channel
out instruct emul xen earlier fs gs segment overrid us uniniti variabl segment base allow local bit pv guest obtain sensit inform hypervisor stack content unspecifi vector relat stale data segment ,Hypervisor
fbld instruct emul xen doe us correct variabl sourc effect address allow local hvm guest obtain hypervisor stack inform read valu us instruct ,Hypervisor
xen write hypervisor map certain shadow paget live migrat perform host tb ram allow local bit pv guest read write invalid memori caus denial servic crash ,Hypervisor
xen earlier doe properli handl certain error allow local hvm guest obtain hypervisor stack memori port memori map write unspecifi oper relat address associ memori ,Hypervisor
unspecifi vulner oracl sparc enterpris seri server run sun firmwar sparc sparc sparc sparc sparc allow local user affect avail unknown vector relat sun firmwar hypervisor ,Hypervisor
lgtosync sy vm ware workstat vm ware player vm ware fusion vm ware esx vm ware esx bit window guest os us allow guest os user gain guest os privileg applic perform craft memori alloc ,Guest OS
link dir suffer unauthent hardwar link vulner ,Physical Hardware
buffer overflow launcher ibm web sphere transform extend allow local user caus denial servic process crash admin consol command stream outag unspecifi vector ,Hypervisor
httpsc onnect open stack keyston open stack comput possibl open stack compon fail valid server ssl certif ,Channel
dispatch discard io function driver block xen blkback blkback xen blkback implement linux kernel allow guest os user caus denial servic data loss filesystem write oper read disk support blkif op discard aka discard trim scsi unmap featur ,Guest OS
denial servic vulner exist motherboard implement intel network control devic devic brought non process state pars hex hex hex valu offset note followup statement intel suggest root caus issu incorrectli configur eeprom imag ,Physical Hardware
directori travers vulner mc afe polici orchestr po allow remot attack upload arbitrari file craft request agent server commun channel demonstr write softwar directori ,Channel
secur bypass vulner exist polar ssl pre weak encrypt error gener diffi hellman valu rsa kei ,Channel
offlineimap doe check ssl server certif valid ssl ye option specifi allow man middl attack ,Channel
mercuri fail verifi common field ssl certif allow remot attack acquir certif certif author perform man middl attack ,Channel
san disk cruzer enterpris usb flash drive valid password program run host devic hardwar allow physic proxim attack access cleartext drive content modifi program ,Physical Hardware
kingston data travel black box dtbb data travel secur privaci edit dtsp data travel elit privaci edit dtep usb flash drive prevent password replai attack allow physic proxim attack access cleartext drive content provid kei captur usb data stream earlier time ,Physical Hardware
kingston data travel black box dtbb data travel secur privaci edit dtsp data travel elit privaci edit dtep usb flash drive us fix bit kei obtain access cleartext drive content make easier physic proxim attack read modifi data determin provid kei ,Physical Hardware
kingston data travel black box dtbb data travel secur privaci edit dtsp data travel elit privaci edit dtep usb flash drive valid password program run host devic hardwar allow physic proxim attack access cleartext drive content modifi program ,Physical Hardware
rhev vdc ssl certif verifi client red hat enterpris virtual manag window present foundat wpf xaml browser applic connect red hat enterpris virtual manag attack local network us flaw conduct man middl attack trick user think view red hat enterpris virtual manag content actual attack control modifi action user request red hat enterpris virtual manag perform ,Channel
netgear infrant readi na raid iator beta creat ssh root password deriv hardwar serial number make easier remot attack guess password obtain login access ,Channel
unknown vulner cipher hardwar secur modul hsm allow local user access secret store modul run time memori certain sequenc command ,Physical Hardware
cisco vpn seri concentr cisco vpn hardwar client allow remot attack caus denial servic slowdown possibl reload flood malform icmp packet ,Physical Hardware
cisco vpn seri concentr cisco vpn hardwar client allow remot attack caus denial servic reload malform ssh initi packet ,Physical Hardware
cisco vpn seri concentr cisco vpn hardwar client rel enabl ip ec tcp port concentr allow remot attack reach network authent ,Physical Hardware
cisco vpn seri concentr hardwar earlier earlier radiu challeng type password authent protocol pap challeng send user password cleartext valid retri request allow remot attack steal password snif ,Physical Hardware
big ip cmp hypervisor incorrectli expos plaintext unit kei cmp guest filesystem ,Hypervisor
vir connect baselin hypervisor cpu vir connect compar hypervisor cpu libvirt api accept emul argument specifi program provid emul domain libvirt execut program probe domain capabl read client specifi arbitrari path argument caus libvirtd execut craft execut privileg ,Hypervisor
app allow attack run arbitrari command root privileg server manag app xen kvm hypervisor exploit vulner attack control singl server given cloud rent sourc server attack craft command trigger app platform execut command root privileg target server ,Hypervisor
version nova expos hypervisor host file guest oper process malici construct qcow filesystem ,Hypervisor
page type function xen arch mm xen debug enabl allow local pv hvm guest administr caus denial servic assert failur hypervisor crash unspecifi vector relat hypercal ,Hypervisor
xenmem exchang handler xen earlier doe properli check memori address allow local pv guest os administr caus denial servic crash possibl gain privileg unspecifi vector overwrit memori hypervisor reserv rang ,Hypervisor
xen downgrad grant tabl version doe properli remov statu page track list free page allow local guest os administr caus denial servic hypervisor crash unspecifi vector ,Hypervisor
gnttabop swap grant ref sub oper grant tabl hypercal xen citrix xen server allow local guest kernel administr caus denial servic host crash possibl gain privileg craft grant refer trigger write arbitrari hypervisor memori locat ,Hypervisor
physdevop map pirq xen citrix xen server earlier allow local hvm guest os kernel caus denial servic host crash possibl read hypervisor guest memori vector relat miss rang check map index ,Hypervisor
xen run bit pv guest bit hypervisor allow local guest os administr caus denial servic infinit loop hang crash invalid argument gnttabop statu frame aka grant tabl hypercal infinit loop vulner ,Hypervisor
directori travers vulner virt disk api py open stack comput nova folsom essex us libvirt base hypervisor allow remot authent user write arbitrari file disk imag dot dot path attribut file element ,Hypervisor
improp access control teltonika firmwar trb allow low privileg user perform unauthor write oper ,Firmware
improp input valid teltonika firmwar trb allow remot authent attack gain root privileg upload malici file ,Firmware
improp input valid teltonika firmwar trb allow remot authent attack gain root privileg upload malici backup archiv ,Firmware
grandstream ht seri firmwar version contain backdoor ssh servic authent remot attack obtain root shell correctli answer challeng prompt ,Firmware
grandstream ht seri firmwar version vulner denial servic attack tr servic unauthent remot attack stop servic pointer derefer tr servic condit trigger mishandl http authent field ,Firmware
grandstream ht seri firmwar version vulner cpu exhaust infinit loop tr servic unauthent remot attack trigger send charact tcp messag tr servic ,Firmware
vulner allow remot attack issu command affect instal hmi ea firmwar version touch screen panel authent requir exploit vulner specif flaw exist ea http ex process issu result lack authent prior allow alter configur attack leverag vulner issu command physic equip control devic zdi ,Firmware
vulner allow remot attack bypass authent affect instal hmi ea firmwar version touch screen panel authent requir exploit vulner specif flaw exist authent mechan issu insuffici authent post authent request attack leverag vulner escal privileg resourc normal unauthent user zdi ,Firmware
incorrect access control firmwar synapt vf xx famili fingerprint sensor includ extern flash version prior allow local administr physic attack compromis confidenti sensor data inject unverifi partit tabl ,Firmware
insuffici output sanit teltonika firmwar trb allow remot authent attack conduct persist cross site script xss attack inject malici client code url host connect form data server configur section ,Firmware
memori corrupt issu address improv lock state check issu fix os mac os mojav tv os malici applic caus unexpect chang memori share process ,Host OS
bound read address improv bound check issu fix os mac os mojav watch os malici applic abl elev privileg ,Host OS
mac os high sierra buffer overflow address improv valid ,Host OS
mac os high sierra bound read address improv input valid ,Host OS
mac os high sierra input valid issu exist kernel issu address improv input valid ,Host OS
issu discov bosch smart camera app android improperli implement tl certif check malici actor potenti succe execut man middl attack connect bosch smart home app affect os app affect ,Channel
vulner detect engin cisco firepow threat defens softwar allow unauthent remot attack caus unexpect restart snort detect engin result denial servic condit vulner incomplet error handl ssl tl packet header connect establish attack exploit vulner send craft ssl tl packet connect handshak exploit allow attack caus snort detect engin unexpectedli restart result partial condit detect engin restart version prior affect ,Channel
ibm web sphere applic server provid weaker expect secur caus improp tl configur remot attack exploit vulner obtain sensit inform man middl techniqu ibm forc id ,Channel
kube rbac proxi contain version us red hat open shift contain platform doe honor tl configur allow us insecur cipher tl attack target traffic sent tl connect weak configur potenti encrypt ,Channel
nespresso prodigio devic lack bluetooth connect secur ,Physical Hardware
bluetooth low energi ble subsystem tapplock devic allow replai attack ,Physical Hardware
jura devic lack bluetooth connect secur ,Physical Hardware
bluetooth low energi ble subsystem tapplock devic reli kei serial unlock oper deriv mac address broadcast devic ,Physical Hardware
http paramet pollut issu discov shenzhen dragon brother fingerprint bluetooth round padlock fb user id user lock mac address unbind exist owner lock bind instead lead complet takeov lock user id mac address trivial obtain api android os applic mac address lock attack transfer ownership lock current user attack account render lock complet inaccess current user ,Physical Hardware
clone version elm obd bluetooth devic hardcod pin lead arbitrari command obd ii bu vehicl ,Physical Hardware
exploit improp access control vulner exist bluetooth low energi function winco firework fly fw attack connect devic trigger vulner ,Physical Hardware
heap data infoleak multipl locat includ cap pars conf rsp linux kernel rc ,Physical Hardware
