CVEDescription,Characterization
netflow stat function netflow php pandora fm ng allow remot authent user execut arbitrari os command shell metacharact ip src paramet index php oper netflow nf live view request issu fix pandora fm ng ,Host OS
wolf ssl mishandl call wc signatur gener hash lead fault inject rsa cryptographi ,Channel
linux kernel rc distribut ubuntu linux git kernel ubuntu com mount craft fs filesystem imag perform oper lead slab bound read access ttm page driver gpu drm ttm ttm page alloc relat vmwgfx ttm modul ,Host OS
linux kernel mount craft btrf filesystem imag perform oper caus slab bound write access btrf map block fs btrf volum valu number data stripe mishandl ,Host OS
linux kernel mount craft btrf filesystem imag perform oper make syncf lead us free mutex lock kernel lock mutex relat mutex spin owner kernel lock mutex btrf qgroup free meta fs btrf qgroup btrf insert delai item fs btrf delai inod ,Host OS
issu discov xen allow hvm pvh guest os user caus denial servic guest os crash vmx vme ntry check mishandl certain xsa background mov ss shadow xsa background need db intercept vmx vme ntry check like exact combin state occur db intercept singl step activ block sti mov ss activ despit legitim state result vme ntry failur fatal guest hvm pvh guest userspac code abl crash guest result guest denial servic version xen affect system support vmx hardwar extens intel cyrix zhaoxin cpu affect arm amd system unaffect hvm pvh guest affect pv guest leverag vulner ,Guest OS
issu discov xen allow guest os user caus denial servic infinit loop certain bit iter mishandl number place bitmap us hypervisor track certain state iter bit involv function misbehav certain corner case access bitmap compil time known incur undefin behavior particular result infinit loop malici guest caus hypervisor crash hang result denial servic version xen vulner system node vulner system xen run system node vulner ,Hypervisor
issu discov xen allow bit arm guest os user caus denial servic bound access certain bit iter mishandl number place bitmap us hypervisor track certain state iter bit involv function misbehav certain corner case bit arm access bitmap bit count multipl bound access occur malici guest caus hypervisor crash hang result denial servic version xen vulner bit arm system vulner bit arm system vulner ,Hypervisor
issu discov xen allow pv guest os user gain host os privileg leverag race condit paget promot demot oper incomplet fix cve xsa address critic issu restart pv type chang oper despit extens test audit corner case miss malici pv guest administr abl escal privileg host secur support version xen vulner system affect arm system affect pv guest leverag vulner hvm pvh guest leverag vulner note attack requir precis time difficult exploit practic ,Guest OS
issu discov xen allow pv guest os user caus denial servic degener chain linear paget incorrect fix cve linear paget techniqu involv point paget paget higher level xen limit support linear paget page point point paget level xsa introduc addit restrict limit depth chain allow page point page level point page level implement track number outstand time page point point page tabl prevent happen time unfortun origin commit introduc reset count resum valid partial valid paget incorrectli drop linear pt entri count attack engin situat occur abl make loop arbitrari chain linear paget describ xsa malici buggi pv guest caus hypervisor crash result denial servic affect entir host privileg escal inform leak exclud version xen vulner system affect arm system affect pv guest leverag vulner hvm pvh guest leverag vulner system enabl linear paget vulner system disabl linear paget select config pv linear pt build hypervisor ad pv linear pt fals command line vulner ,Hypervisor
issu discov xen allow amd hvm guest os user caus denial servic possibl gain privileg trigger data structur access paget height updat run amd system iommu xen attempt dynam adapt number level paget paget height iommu accord guest address space code select updat height bug notabl updat take lock necessari safe oper malici guest administr caus xen access data structur modifi caus xen crash privileg escal thought difficult rule addition potenti memori leak kb guest boot memori pressur xen amd cpu vulner xen run intel cpu vulner arm system vulner system guest given direct access physic devic vulner system us pci pass vulner hvm guest exploit vulner pv pvh guest version xen iommu support vulner ,Guest OS
vulner cisco webex meet mobil os allow unauthent remot attack gain unauthor read access sensit data invalid secur socket layer ssl certif vulner insuffici ssl certif valid affect softwar attack exploit vulner suppli craft ssl certif affect devic success exploit allow attack conduct man middl attack decrypt confidenti inform user connect affect softwar ,Channel
linux kernel mount craft btrf filesystem imag perform oper make syncf lead us free merg free space fs btrf free space cach pointer left data structur pointer right data structur ,Host OS
red hat enterpris linux kpatch updat did includ complet fix cve flaw wai intel cpu handl inconsist physic memori address translat cpu local cach softwar page structur entri privileg guest user us flaw induc hardwar machin check error host processor result sever scenario halt processor softwar like os machin monitor vmm us memori store program instruct data memori memori us page structur like page tabl page directori manag memori processor memori manag unit mmu us page structur entri translat program memori address physic memori address processor store address translat local cach buffer call translat lookasid buffer tlb tlb part instruct data address softwar modifi page structur entri chang address map certain attribut like page page structur alter memori softwar invalid correspond address translat processor tlb cach tlb invalid take place privileg guest user trigger instruct fetch oper us cach invalid physic address translat instruct tlb itlb access invalid physic memori address result halt processor machin check error mce page chang ,Host OS
flaw fix cve linux upstream kernel version wai intel cpu handl specul execut instruct tsx asynchron abort taa error occur guest run host cpu affect taa flaw taa affect md issu md guest clear affect buffer verw instruct mechan md bit export guest guest did us verw mechan clear affect buffer issu affect guest run cascad lake cpu requir host tsx enabl confidenti data highest threat associ vulner ,Host OS
bound memori write issu linux kernel version wai linux kernel kvm hypervisor handl kvm emul cpuid ioctl request cpuid featur emul kvm hypervisor user process abl access dev kvm devic us flaw crash result denial servic ,Hypervisor
vulner identifi si nvr central control server cc version si nvr video server version si nvr central control server cc contain sql inject vulner xml base commun protocol provid port tcp tcp authent remot attack exploit vulner read modifi cc databas potenti execut administr databas oper oper command ,Host OS
samsung mobil devic softwar exyno chipset rkp aka samsung hypervisor el implement allow arbitrari memori write oper samsung id sve ,Hypervisor
fm desktop app fm scrobbler mac os make http request includ api kei us ssl tl enabl ssl option disabl cleartext request soon app start ,Channel
shift bit box devic channel row base ol displai power consumpt row base displai cycl depend number illumin pixel allow partial recoveri displai content exampl hardwar implant usb cabl abl leverag behavior recov confidenti secret pin bip mnemon note bip secret displai devic channel relev attack control devic usb connect make power consumpt measur time secret data displai channel relev circumst stolen devic current displai secret data ,Channel
insuffici check usb packet handl shape shift kei hardwar wallet firmwar allow bound write bss segment craft messag vulner allow code execut form impact trigger unauthent attack reachabl web usb ,Physical Hardware
vulner secur shell ssh authent process cisco small busi switch softwar allow attack bypass client certif authent revert password authent vulner exist open ssh mishandl authent process attack exploit vulner attempt connect devic ssh success exploit allow attack access configur administr user credenti chang workaround avail client certif authent enabl disabl us strong password authent client certif authent disabl ,Channel
issu discov xen allow bit pv guest os user gain guest os privileg instal descriptor miss descriptor tabl limit check pv emul emul certain pv guest oper descriptor tabl access perform emul code access respect guest specifi limit unless guarante fail emul bit guest user mode call gate allow guest user mode instal us descriptor choic guest kernel did instal ldt os es don instal ldt bit pv guest user mode elev privileg guest kernel xen version onward affect bit pv guest user mode leverag vulner hvm pvh bit pv guest leverag vulner arm system unaffect ,Guest OS
issu discov xen allow arm guest os user caus denial servic xenmem add physmap hypercal max map gfn us function resolv translat fault entri saniti check guest physic frame rest code function assum valid root tabl check bug function root pointer ignor unus bit guest physic frame mean function set entri alia frame max map gfn updat origin frame possibl set max map gfn high cover frame lead root pointer entri resolv translat fault addition saniti check max map gfn allow highest map consid valid root pointer problem trigger special craft hypercal xenmem add physmap batch follow access address hypercal direct access pass saniti check caus root pointer malici guest administr caus hypervisor crash result denial servic xen version newer vulner arm system vulner system affect ,Hypervisor
issu discov xen allow arm guest os user caus denial servic gain privileg leverag erron enabl interrupt interrupt uncondition unmask except handler except occur arm handl chang processor level interrupt uncondition enabl except entri except occur interrupt mask effect unmask interrupt malici guest contriv arrang critic xen code run interrupt erron enabl lead data corrupt denial servic possibl privileg escal precis attack techniqu identifi ,Guest OS
issu discov xen allow pv guest os user gain host os privileg leverag race condit paget promot demot oper issu restart pv type chang oper avoid shadow paget pv guest xen expos actual hardwar paget guest order prevent guest modifi page tabl directli xen keep track page us type page promot us paget demot us type xen allow recurs promot oper promot page paget end caus page promot turn caus page promot oper arbitrarili larg time startabl unfortun make recurs paget promot demot oper restart incred complic code contain race trigger caus xen drop retain extra type count potenti allow guest write access us paget malici pv guest administr abl escal privileg host system untrust pv guest vulner hvm pvh guest exercis vulner ,Guest OS
issu discov xen allow pv guest os user caus denial servic vcpuop initialis hypercal hypercal creat continu variad function us printf like format interpret paramet error handl bad format charact bug crash xen path vcpuop initialis hypercal bad format charact bug hit vcpuop initialis execut suffici period time continu creat malici guest caus hypervisor crash result denial servic xen version newer vulner xen version earlier vulner pv guest exploit vulner hvm pvh guest guest arm system exploit vulner ,Hypervisor
vulner secur shell ssh authent function cisco io xr softwar allow authent remot attack successfulli log affect devic distinct usernam vulner logic error occur certain sequenc action process ssh login event affect devic attack exploit vulner initi ssh session devic specif sequenc present usernam success exploit result log data misrepresent user enumer certain circumst command author bypass detail section inform ,Channel
zoho manag engin ad elf servic plu csrf user profil inform page user attack vulner forc modifi enrol inform email mobil phone unintention attack us reset password function control send authent code channel attack ,Channel
heap base buffer overflow vrend render transfer write iov function vrend render virglrender allow guest os user caus denial servic virgl ccmd resourc write command ,Guest OS
bound read vrend blit need swizzl function vrend render virglrender allow guest os user caus denial servic virgl ccmd blit command ,Guest OS
heap base buffer overflow vrend render transfer write iov function vrend render virglrender allow guest os user caus denial servic qemu guest host escap code execut virgl ccmd resourc write command ,Guest OS
pointer derefer vrend render virglrender allow guest os user caus denial servic malform command ,Guest OS
biotronik cardio messeng ii affect product transmit credenti clear text prior switch encrypt commun channel attack disclos product client credenti connect biotronik remot commun infrastructur ,Channel
philip intelli bridg ec ec intelli bridg ec hub version intelli bridg ec hub version ssh server run affect product configur allow weak cipher enabl unauthor attack access network captur replai session gain unauthor access ec hub ,Channel
ecdsa signatur implement ecdsa arm mbed crypto mbed tl doe reduc blind scalar comput invers allow local attack recov kei channel attack ,Channel
issu discov driver xen balloon linux kernel us xen allow guest os user caus denial servic unrestrict resourc consumpt map guest memori aka cid ef ab ,Guest OS
issu discov xen allow pv guest os user caus denial servic incompat process context identifi pcid shadow paget switch ,Guest OS
issu discov xen allow pv guest os user caus denial servic gain privileg guest manipul virtualis cr wai incompat linux possibl guest kernel ,Guest OS
issu discov xen allow pv guest os user caus denial servic gain privileg incompat process context identifi pcid tlb flush ,Guest OS
issu discov xen allow pv guest os user caus denial servic mishandl fail iommu oper caus bug check cleanup crash guest ,Guest OS
issu discov xen allow pv guest os user caus denial servic leverag run oper exist support restart pte updat ,Guest OS
issu discov xen allow pv guest os user caus denial servic gain privileg leverag incorrect us hvm physmap concept pv domain ,Guest OS
issu discov xen allow pv guest os user caus denial servic gain privileg leverag race condit aros xenmem exchang introduc ,Guest OS
issu discov xen allow pv guest os user caus denial servic gain privileg leverag page writabl race condit addit pass pci devic ,Guest OS
issu discov xen allow guest os user caus denial servic gain privileg grant tabl transfer request mishandl ,Guest OS
signal messeng applic android allow caller forc answer calle user interact connect messag exist notic calle audio channel open calle block eavesdrop ,Channel
unauthent remot code execut occur link product dir dir dir dhp issu occur attack send arbitrari input ping test devic common gatewai lead common inject attack successfulli trigger command inject achiev compromis later independ affect dir dap dir dir dir dir ,Physical Hardware
vulner cli cisco enterpris nfv infrastructur softwar nfvi allow authent local attack access shell underli linux oper affect devic vulner improp input valid affect softwar attack exploit vulner send craft command affect devic exploit allow attack gain shell access nonroot user account underli linux oper affect devic potenti access configur file sensit inform vulner affect consol connect cimc doe appli remot connect telnet ssh ,Channel
link dir na devic vulner authent bypass check authent server reli client valid bypass note end life product ,Physical Hardware
vulner report trust manag brocad san nav version allow attack perform man middl attack secur socket layer ssl connect ,Channel
limesurvei doe enforc ssl tl usag configur ,Channel
vulner fibr channel ethernet fc port virtual npv protocol implement cisco nx os softwar allow unauthent adjac attack caus denial servic condit vulner incorrect process fc packet fcoe npv featur uninstal attack exploit vulner send stream fc frame adjac host affect devic exploit allow attack caus packet amplif occur result satur interfac condit nexu seri switch standalon nx os mode affect run softwar version prior ,Channel
vulner fibr channel ethernet fc protocol implement cisco nx os softwar allow unauthent adjac attack caus denial servic condit affect devic vulner incorrect alloc intern index adjac attack abil submit craft fc packet cross affect interfac trigger vulner success exploit allow attack caus packet loop high throughput affect interfac result condit vulner fix version ,Channel
smart card athena sc manufactur base atmel toolbox sc chip contain time channel ecdsa signatur gener allow local attack abl measur durat hundr thousand sign oper comput kei us issu occur atmel toolbox contain version ecdsa signatur function describ fast secur affect card chose us fast version leak bit length random nonc time affect athena idp rotect athena idp rotect athena idp rotect athena idp rotect valid id flex safe net token tec sec armor card tec sec armor card ,Channel
insuffici entropi prng vulner fortinet forti os devic enabl hardwar trng token model support builtin trng seed allow attack theoret recov term ecdsa secret tl client rsa handshak mutual ecdsa authent help flush reload channel attack forti gate vm model ,Channel
miss ssl certif valid pw termin emul version ,Channel
black box compel us onelan net box product credenti allow remot attack access devic remot ssh http http ftp ,Channel
open ssl introduc rewritten random number gener rng intend includ protect event fork order ensur parent child process did share rng state protect us partial mitig issu output high precis timer mix rng state likelihood parent child process share state significantli reduc applic call openssl init crypto explicitli openssl init atfork problem doe occur fix open ssl affect ,Channel
normal open ssl ec group factor present us channel resist code path case possibl construct group paramet instead name curv case possibl group doe cofactor present occur paramet match known name curv curv us open ssl fall non channel resist code path result kei recoveri ecdsa signatur oper order vulner attack abil time creation larg number signatur paramet factor present us applic libcrypto avoid doubt libssl vulner paramet us fix open ssl affect fix open ssl affect fix open ssl affect ,Channel
bound access issu linux kernel version wai linux kernel kvm hypervisor coalesc mmio write oper oper mmio ring buffer kvm coalesc mmio write indic ring ring valu suppli host user space process unprivileg host user process access dev kvm devic us flaw crash host kernel result denial servic potenti escal privileg ,Hypervisor
hyundai pai kass hk devic channel row base ol displai power consumpt row base displai cycl depend number illumin pixel allow partial recoveri displai content exampl hardwar implant usb cabl abl leverag behavior recov confidenti secret pin bip mnemon word channel relev attack control devic usb connect make power consumpt measur time secret data displai channel relev circumst stolen devic current displai secret data ,Physical Hardware
disput bc vault devic channel row base ssd ol displai power consumpt row base displai cycl depend number illumin pixel allow partial recoveri displai content exampl hardwar implant usb cabl abl leverag behavior recov data valu word channel relev attack control devic usb connect make power consumpt measur time secret data displai channel relev circumst stolen devic current displai secret data note vendor posit secur impact potenti leak inform number charact pin ,Physical Hardware
archo safe devic channel row base ol displai power consumpt row base displai cycl depend number illumin pixel allow partial recoveri displai content exampl hardwar implant usb cabl abl leverag behavior recov confidenti secret pin bip mnemon word channel relev attack control devic usb connect make power consumpt measur time secret data displai channel relev circumst stolen devic current displai secret data ,Physical Hardware
disput mooltipass mini devic channel row base ol displai power consumpt row base displai cycl depend number illumin pixel allow partial recoveri displai content exampl hardwar implant usb cabl abl leverag behavior recov confidenti secret pin word channel relev attack control devic usb connect make power consumpt measur time secret data displai channel relev circumst stolen devic current displai secret data note vendor posit attack realist implement ,Physical Hardware
disput coldcard mk mk devic channel row base ol displai power consumpt row base displai cycl depend number illumin pixel allow partial recoveri displai content exampl hardwar implant usb cabl abl leverag behavior recov confidenti secret pin bip mnemon word channel relev attack control devic usb connect make power consumpt measur time secret data displai channel relev circumst stolen devic current displai secret data coldcard mk mk devic channel row base ol displai power consumpt row base displai cycl depend number illumin pixel allow partial recoveri displai content exampl hardwar implant usb cabl abl leverag behavior recov confidenti secret pin bip mnemon word channel relev attack control devic usb connect make power consumpt measur time secret data displai channel relev circumst stolen devic current displai secret data note coinkit ve mitig feel strongli legitim issu opinion unproven work complet impract work perfectli ,Physical Hardware
disput shape shift kei devic channel row base ol displai power consumpt row base displai cycl depend number illumin pixel allow partial recoveri displai content exampl hardwar implant usb cabl abl leverag behavior recov secret data shown displai word channel relev attack control devic usb connect make power consumpt measur time secret data displai channel relev circumst stolen devic current displai secret data note vendor posit insignific risk ,Physical Hardware
ledger nano nano devic channel row base ol displai power consumpt row base displai cycl depend number illumin pixel allow partial recoveri displai content exampl hardwar implant usb cabl abl leverag behavior recov confidenti secret pin bip mnemon word channel relev attack control devic usb connect make power consumpt measur time secret data displai channel relev circumst stolen devic current displai secret data ,Physical Hardware
trezor devic channel row base ol displai power consumpt row base displai cycl depend number illumin pixel allow partial recoveri displai content exampl hardwar implant usb cabl abl leverag behavior recov confidenti secret pin bip mnemon word channel relev attack control devic usb connect make power consumpt measur time secret data displai channel relev circumst stolen devic current displai secret data note cve appli exclus trezor doe refer issu ol displai devic ,Physical Hardware
secur featur bypass vulner exist window netlogon improperli handl secur commun channel aka net logon secur featur bypass vulner ,Channel
buffer overflow lack upper bound check channel length us loop snapdragon comput snapdragon connect snapdragon consum electron connect snapdragon consum iot snapdragon industri iot snapdragon mobil snapdragon wire infrastructur network apq ipq ipq msm nicobar qca qcn qc qc rennel sc sda sda sdm sdm sdm sdm sdm sdm sdm sm sm sm sxr sxr ,Channel
us non time constant comparison function issu time channel us potenti channel sui corrupt snapdragon snapdragon comput snapdragon connect snapdragon consum iot snapdragon industri iot snapdragon mobil snapdragon voic music snapdragon wire infrastructur network apq apq apq apq apq au apq mdm mdm mdm mdm mdm msm msm msm msm msm msm msm msm msm au msm nicobar qc qc qc qm rennel sa sc sda sda sdm sdm sdm sdm sdm sdm sdm sdm sdm sdm sdm sdx sdx sm sm sm sxr sxr ,Channel
wolf ssl wolf crypt earlier configur enabl fpecc enabl sp enabl sp math contain time channel ecdsa signatur gener allow local attack abl precis measur durat signatur oper infer inform nonc us potenti mount lattic attack recov kei us issu occur ecc scalar multipl leak bit length ,Channel
issu discov link dir lw devic beta command inject hnap set wan set xml inject valu gatewai kei ,Physical Hardware
issu discov link dir lw devic beta command inject hnap set wan set xml inject valu ipa ddress kei ,Physical Hardware
vulner io applic environ cisco io softwar allow authent remot attack gain unauthor access guest oper guest os run affect devic vulner incorrect role base access control rbac evalu low privileg user request access guest os restrict administr account attack exploit vulner authent guest os low privileg user credenti exploit allow attack gain unauthor access guest os root user ,Guest OS
vulner cisco hyper flex softwar allow unauthent remot attack perform man middl attack vulner insuffici kei manag attack exploit vulner obtain specif encrypt kei cluster success exploit allow attack perform man middl attack node cluster ,Channel
asu ptpf ilter sy asu precis touch pad hardwar pool overflow associ asu tp devic lead potenti privileg escal craft devic io control ,Physical Hardware
jenkin cadenc manag plugin earlier disabl ssl tl hostnam verif global jenkin master jvm ,Channel
flaw linux kernel freescal hypervisor manag implement kernel version exclud paramet pass ioctl incorrectli valid us calcul page calcul attack us flaw crash corrupt memori creat advers secur affect ,Hypervisor
tl enabl ssl endpoint identif enabl set true apach geod fail perform hostnam verif entri certif san ssl handshak compromis intra cluster commun man middl attack ,Channel
