CVEDescription,Characterization
memori consumpt issu address improv memori handl issu fix os pad os mac os catalina supplement updat tv os watch os applic abl execut arbitrari code kernel privileg ,Host OS
integ overflow address improv input valid issu fix os pad os mac os catalina tv os watch os malici applic abl execut arbitrari code kernel privileg ,Host OS
logic issu address improv restrict issu fix os pad os tv os watch os safari tune window cloud window cloud window remot attack abl caus arbitrari code execut ,Host OS
author issu address improv state manag issu fix os pad os person physic access os devic abl view notif content lockscreen ,Host OS
free issu address improv memori manag issu fix os pad os mac os catalina remot attack abl caus unexpect termin corrupt kernel memori ,Host OS
input valid issu address improv input valid issu fix os pad os tv os watch os safari tune window cloud window cloud window process malici craft web content lead cross site script attack ,Host OS
issu address improv check issu fix os pad os mac os catalina tv os watch os applic abl us arbitrari entitl ,Host OS
race condit address improv state handl issu fix os pad os mac os catalina tv os watch os applic abl gain elev privileg ,Host OS
bound read address improv bound check issu fix os pad os remot attack abl caus arbitrari code execut ,Host OS
bound read address improv bound check issu fix os pad os mac os catalina tv os remot attack abl leak memori ,Host OS
issu exist paus face time video issu resolv improv logic issu fix os pad os user video paus face time exit face time app ring ,Host OS
memori initi issu address improv memori handl issu fix mac os catalina local user abl read kernel memori ,Host OS
bound read address improv input valid issu fix mac os catalina malici applic abl determin kernel memori layout ,Host OS
memori corrupt issu address improv state manag issu fix mac os catalina applic abl execut arbitrari code kernel privileg ,Host OS
valid issu address improv input sanit issu fix os pad os tv os watch os process malici craft text messag lead applic denial servic ,Host OS
denial servic issu address improv input valid issu fix os pad os mac os catalina tv os watch os remot attack abl caus denial servic ,Host OS
denial servic issu address improv input valid issu fix os pad os mac os catalina remot attack abl caus denial servic ,Host OS
access issu address addit sandbox restrict issu fix os pad os mac os catalina malici applic abl bypass privaci prefer ,Host OS
bound write issu address improv bound check issu fix mac os catalina malici applic abl execut arbitrari code kernel privileg ,Host OS
memori corrupt issu address improv state manag issu fix os pad os mac os catalina tv os watch os malici applic abl execut arbitrari code kernel privileg ,Host OS
logic issu exist result memori corrupt address improv state manag issu fix os pad os mac os catalina tv os watch os malici applic abl execut arbitrari code kernel privileg ,Host OS
inform disclosur issu address improv state manag issu fix os pad os mac os catalina tv os watch os local user abl read kernel memori ,Host OS
multipl memori corrupt issu address improv state manag issu fix os pad os mac os catalina tv os watch os malici applic abl execut arbitrari code kernel privileg ,Host OS
patriot viper rgb driver prior expos ioctl allow insuffici access control ioctl code allow local user low privileg read write byte io port leverag number wai ultim run code elev privileg ,Host OS
openssl check ip asc lua openssl mishandl certif valid us lua pushboolean certain non valu ,Channel
huawei product ip modul ngfw modul nip nip nip secospac usg secospac usg secospac usg usg version improp authent vulner attack need perform oper exploit vulner success exploit obtain certain permiss devic ,Physical Hardware
vulner allow local attack escal privileg affect instal parallel desktop attack obtain abil execut high privileg code target guest order exploit vulner specif flaw exist hci compon issu result lack proper valid user suppli data result integ overflow alloc buffer attack leverag vulner escal privileg execut code context hypervisor zdi ,Guest OS
vulner allow local attack escal privileg affect instal parallel desktop attack obtain abil execut high privileg code target guest order exploit vulner specif flaw exist hci compon issu result lack proper lock perform oper attack leverag vulner escal privileg execut code context hypervisor zdi ,Guest OS
vulner allow local attack disclos sensit inform affect instal parallel desktop attack obtain abil execut high privileg code target guest order exploit vulner specif flaw exist hci compon issu result lack proper valid user suppli data result read past end alloc buffer attack leverag conjunct vulner execut code context hypervisor zdi ,Guest OS
vulner allow local attack escal privileg affect instal parallel desktop attack obtain abil execut high privileg code target guest order exploit vulner specif flaw exist vga devic issu result lack proper valid user suppli data result write past end alloc buffer attack leverag vulner escal privileg execut code context hypervisor zdi ,Guest OS
oklok mobil companion app fingerprint bluetooth padlock fb inform exposur issu mobil app attempt add bound lock barcod reveal email address account lock bound lock valid barcod input easili guess barcod string follow predict pattern correctli guess valid barcod input enter app disclos arbitrari user email address lock name ,Physical Hardware
oklok mobil companion app fingerprint bluetooth padlock fb allow remot attack submit api request authent unauthor token result idor issu remot attack us token make unauthor api request behalf arbitrari user id valid current user id trivial guess user id assign convent us app remot attack harvest email address unsalt md password hash owner assign lock name owner assign fingerprint name rang arbitrari user id ,Physical Hardware
oklok mobil companion app fingerprint bluetooth padlock fb weak password requir combin improp restrict excess authent attempt allow remot attack discov user credenti obtain access brute forc attack ,Physical Hardware
unquot servic path vulner report lenovo driver manag prior version allow authent user execut code elev privileg ,Host OS
potenti vulner smi callback function us legaci sd driver lenovo think pad think station lenovo notebook model allow arbitrari code execut ,Host OS
potenti vulner smi callback function us legaci usb driver lenovo notebook think station model allow arbitrari code execut ,Host OS
potenti vulner smi callback function us lock preinstal driver lenovo notebook think station model allow arbitrari code execut ,Host OS
dll search path vulner report lenovo driver manag prior version allow authent user execut code elev privileg ,Host OS
issu discov plu pro devic gm ba firmwar contain function allow privileg user root rich execut environ ree obtain bitmap imag fingerprint sensor leftov debug code issu trust applic ta support extend number command need implement fingerprint authent compat android attack posit send command ta exampl root user abl send sequenc command result ta send raw fingerprint imag ree mean trust execut environ tee longer protect identifi fingerprint data ree ,Firmware
synergi system solut sss huski rtu firmwar version prior incorrect permiss cwe vulner affect product vulner insuffici permiss allow attack view network configur snmp commun differ issu cve cve cve cve cve ,Firmware
synergi system solut sss huski rtu firmwar version prior exposur sensit inform unauthor actor cwe vulner affect product vulner inform exposur snmp protocol differ issu cve cve cve cve cve ,Firmware
synergi system solut sss huski rtu firmwar version prior improp check unusu except condit cwe vulner affect product vulner special craft tcp packet caus devic shut reboot lose configur set differ issu cve cve cve cve cve ,Firmware
cwe cleartext storag sensit inform vulner exist easergi firmwar version older allow attack intercept traffic read configur data ,Firmware
cwe us platform depend parti compon vulner vulner exist easergi firmwar version older allow attack exploit compon ,Firmware
cwe us broken riski cryptograph algorithm vulner exist easergi firmwar version older allow attack acquir password brute forc ,Firmware
cwe inform exposur vulner exist easergi firmwar version older allow attack obtain kei ,Firmware
cwe improp privileg manag write vulner exist easergi firmwar version older allow attack elev privileg file ,Firmware
cwe improp restrict excess authent attempt vulner exist easergi firmwar version older allow attack gain access brute forc ,Firmware
cwe uncontrol resourc consumpt vulner exist easergi firmwar version older allow attack login multipl time result denial servic ,Firmware
cwe file directori inform exposur vulner exist easergi firmwar version older allow attack pack unpack archiv firmwar control modul usual tar archiv result inform exposur ,Firmware
cwe download code integr check vulner exist easergi firmwar version older allow attack inject data danger content firmwar execut arbitrari code ,Firmware
cwe improp input valid vulner exist easergi firmwar version older allow attack disabl webserv servic devic special craft network packet sent ,Firmware
cwe cross site request forgeri csrf vulner exist easergi firmwar version older allow attack execut malici command behalf legitim user xsrf token data intercept ,Firmware
cwe bound write vulner exist modicon logic control firmwar version prior caus denial servic specif tcp ip craft packet sent modicon logic control ,Firmware
cwe us hard code credenti vulner exist vijeo design basic hot fix prior vijeo design sp prior caus unauthor read write download upload project firmwar vijeo design basic vijeo design ,Firmware
sonoff th devic firmwar allow xss friendli field success login web admin password ,Firmware
free bsd stabl releas stabl releas rc invalid memori locat us hid item push pop level restor process hid item allow attack physic access usb port abl us special craft usb devic gain kernel user space code execut ,Host OS
potenti secur vulner identifi disk drive firmwar instal name supplement updat onlin rom flash compon hpe server run linux vulner softwar includ hpe servic pack pro liant spp releas vulner softwar supplement updat onlin rom flash compon linux softwar instal softwar compon local exploit execut arbitrari code drive model vulner resolut field secur bulletin spp supplement updat onlin rom flash compon linux fix issu ,Firmware
moxa ed seri firmwar version lower attack execut arbitrari code target devic caus servic ,Firmware
systech corpor nd termin server nd port rj firmwar version success exploit vulner allow inform disclosur limit avail allow remot code execut ,Firmware
moxa io logik seri firmwar version lower io xpress configur util version lower sensit inform transmit web applic clear text ,Firmware
moxa ed seri firmwar version lower affect product us weak cryptograph algorithm allow confidenti inform disclos ,Firmware
moxa ed seri firmwar version lower paramet set page ensur text correct buffer ,Firmware
moxa ed seri firmwar version lower sensit inform transmit web applic cleartext ,Firmware
moxa pt seri firmwar version lower pt seri firmwar version lower applic util weak password requir allow attack gain unauthor access ,Firmware
moxa pt seri firmwar version lower pt seri firmwar version lower attack gain access sensit inform web servic author ,Firmware
moxa ed seri firmwar version lower weak password requir allow attack gain access brute forc ,Firmware
moxa pt seri firmwar version lower pt seri firmwar version lower buffer overflow web server allow remot attack caus denial servic condit execut arbitrari code ,Firmware
moxa pt seri firmwar version lower pt seri firmwar version lower affect product us weak cryptograph algorithm allow confidenti inform disclos ,Firmware
moxa pt seri firmwar version lower pt seri firmwar version lower devic us hard code servic code access consol ,Firmware
moxa pt seri firmwar version lower pt seri firmwar version lower affect product us hard code cryptograph kei increas possibl confidenti data recov ,Firmware
moxa ed seri firmwar version lower attack gain access proper authent ,Firmware
moxa ed seri firmwar version lower affect product us hard code cryptograph kei increas possibl confidenti data recov ,Firmware
digi intern connect port lt mei firmwar version bio version success exploit vulner allow attack upload malici file applic ,Firmware
honeywel notifi web server nw version vulner path travers attack allow attack bypass access restrict directori honeywel releas firmwar updat address problem ,Firmware
digi intern connect port lt mei firmwar version bio version multipl cross site script vulner exist allow attack caus denial servic condit ,Firmware
possibl unmask credenti sensit inform unprotect project file allow attack remot access touch panel ea seri firmwar version prior manipul configur ,Firmware
cacagoo cloud storag intellig camera tv zd mp firmwar weak authent telnet access lead root privileg password requir ,Firmware
broadcom chip mishandl bluetooth random number gener low entropi pseudo random number gener prng us situat hardwar random number gener hrng us prevent spoof affect exampl samsung galaxi note devic bcm chipset samsung id sve ,Physical Hardware
sap host agent version allow attack admin privileg us oper framework gain root privileg underli oper lead privileg escal ,Host OS
sap host agent version allow unprivileg user read share memori write share memori send request saposcol process receiv respons contain data read user root privileg directori hardwar os detail lead miss author check vulner ,Physical Hardware
nvidia gpu manag guest driver contain vulner gpu plugin potenti execut privileg oper lead denial servic affect gpu version prior version prior version prior ,Guest OS
nvidia linux gpu displai driver version contain vulner uvm driver race condit lead denial servic ,Host OS
nvidia window gpu displai driver version contain vulner kernel mode layer nvlddmkm sy handler dxgk ddi escap pointer dereferenc lead denial servic potenti escal privileg ,Host OS
nvidia window gpu displai driver version contain vulner direct user mode driver nvwgf um dll special craft shader caus bound access lead denial servic ,Host OS
nvidia window gpu displai driver version contain vulner servic host compon applic resourc integr check miss attack lead code execut denial servic inform disclosur ,Host OS
nvidia window gpu displai driver version contain vulner inter process commun api improp access control lead code execut denial servic inform disclosur ,Host OS
nvidia window gpu displai driver version contain vulner nvidia control panel compon attack local access corrupt file lead denial servic escal privileg ,Host OS
nvidia gpu graphic driver guest os contain vulner incorrect resourc clean failur path impact guest vm lead denial servic ,Guest OS
big ip certain configur big ip send data plane traffic end server unencrypt server ssl profil appli ,Channel
big ip process tl traffic hardwar cryptograph acceler enabl platform intel qat hardwar traffic manag microkernel tmm stop respond caus failov event ,Physical Hardware
grandstream gxp seri firmwar vulner authent remot command execut attack add open vpn script phone vpn set addit set field web vpn connect establish user defin script execut root privileg ,Firmware
grandstream gxp seri firmwar vulner authent remot command execut attack upload special craft tar file http cgi bin upload vpntar ,Firmware
authent bypass altern path channel simpli safe ss firmwar allow local unauthent attack pair rogu keypad arm ,Firmware
privileg escal vulner skysea client view ver allow attack obtain unauthor privileg modifi obtain sensit inform perform unintend oper unspecifi vector ,Host OS
soni wireless headphon wf wf sp wh xm wh xm wh ch wh wh xb wh xb wi wi wi sp firmwar version prior vulner bluetooth rang make bluetooth pair oper chang volum product ,Firmware
yamaha lte vo ip router nvr firmwar rev earlier yamaha gigabit vo ip router nvr firmwar rev earlier yamaha gigabit vpn router rtx firmwar rev earlier rtx firmwar rev earlier rtx firmwar rev earlier rtx firmwar rev earlier rtx firmwar rev earlier rtx firmwar rev earlier yamaha broadband vo ip router nvr firmwar rev earlier yamaha firewal fwx firmwar rev earlier allow remot attack caus denial servic unspecifi vector ,Firmware
resourc manag error vulner tcp function includ firmwar mitsubishi electr melqic iu seri iu firmwar version earlier allow remot attack stop network function execut malwar special craft packet ,Firmware
improp neutral argument delimit command argument inject vulner tcp function includ firmwar mitsubishi electr melqic iu seri iu firmwar version earlier allow attack network segment stop network function execut malwar special craft packet ,Firmware
tcp function includ firmwar mitsubishi electr melqic iu seri iu firmwar version earlier allow remot attack bypass access restrict stop network function execut malwar special craft packet ,Firmware
pointer derefer vulner tcp function includ firmwar mitsubishi electr melqic iu seri iu firmwar version earlier allow remot attack stop network function execut malwar special craft packet ,Firmware
tcp function includ firmwar mitsubishi electr melqic iu seri iu firmwar version earlier doe properli manag session allow remot attack stop network function execut malwar special craft packet ,Firmware
buffer error vulner tcp function includ firmwar mitsubishi electr melqic iu seri iu firmwar version earlier allow remot attack stop network function execut malwar special craft packet ,Firmware
aterm wg hs firmwar ver earlier allow authent attack network segment execut arbitrari os command root privileg unspecifi vector ,Firmware
cross site script vulner aterm wg hs firmwar ver earlier allow remot attack inject arbitrari web script html unspecifi vector ,Firmware
mitsubishi electr melsec control modul melipc seri mi melsec seri control modul dhccpu dhccpu vg user ethernet port ch ch digit serial number melsec seri control modul intellig function modul ccpu ethernet port ch ch digit serial number rd ethernet port digit serial number melipc seri mi mi vw ethernet port ch digit serial number firmwar version allow remot attack caus denial servic malwar execut unspecifi vector ,Firmware
aterm seri aterm wf firmwar ver earlier aterm wg cr firmwar ver earlier aterm wg hs firmwar ver earlier allow authent attack network segment execut arbitrari os command root privileg manag screen ,Firmware
aterm seri aterm wf firmwar ver earlier aterm wg cr firmwar ver earlier aterm wg hs firmwar ver earlier allow attack network segment execut arbitrari os command root privileg function ,Firmware
dell dock firmwar updat util dell client consum commerci dock station contain arbitrari file overwrit vulner vulner limit dell dock firmwar updat util time window execut administr time window local authent low privileg malici user exploit vulner trick administr overwrit arbitrari file symlink attack vulner doe affect actual binari payload updat util deliv ,Firmware
dell emc network seri firmwar version older dell emc network pc firmwar version older dell emc power edg vrtx modul firmwar version older contain inform disclosur vulner remot unauthent attack exploit vulner retriev sensit data send special craft request affect endpoint ,Firmware
dell client consum commerci platform contain arbitrari file overwrit vulner vulner limit dell firmwar updat util time window execut administr time window local authent low privileg malici user exploit vulner trick administr overwrit arbitrari file symlink attack vulner doe affect actual binari payload updat util deliv ,Firmware
vm ware esx esx esx sg esx sg workstat fusion contain heap overflow vulner svga devic malici actor local access machin graphic enabl abl exploit vulner execut code hypervisor machin addit condit attack control present exploit possibl ,Hypervisor
vm ware esx esx esx sg esx sg workstat fusion contain bound write vulner usb control hci malici actor local administr privileg machin abl exploit issu crash machin vmx process lead denial servic condit execut code hypervisor machin addit condit attack control present exploit possibl ,Hypervisor
vm ware esx esx esx sg esx sg workstat fusion contain heap overflow vulner usb control ehci malici actor local access machin abl exploit vulner execut code hypervisor machin addit condit attack control present exploit possibl ,Hypervisor
vm ware esx esx esx sg esx sg workstat fusion contain heap overflow race condit issu usb control ehci malici actor local access machin abl exploit vulner execut code hypervisor machin addit condit attack control present exploit possibl ,Hypervisor
vm ware esx esx esx sg esx sg workstat fusion contain inform leak xhci usb control malici actor local access machin abl read privileg inform contain hypervisor memori machin ,Hypervisor
vm ware esx esx esx sg esx sg workstat fusion contain inform leak ehci usb control malici actor local access machin abl read privileg inform contain hypervisor memori addit condit attack control need present exploit possibl ,Hypervisor
vm ware esx esx esx sg esx sg workstat fusion contain us free vulner svga devic malici actor local access machin graphic enabl abl exploit vulner execut code hypervisor machin ,Hypervisor
linux guest vm run vm ware workstat fusion contain local privileg escal vulner improp file permiss cortado thinprint local attack non administr access linux guest vm print enabl exploit issu elev privileg root guest vm ,Guest OS
vm ware workstat fusion contain us vulner vmnetdhcp success exploit issu lead code execut host guest allow attack creat denial servic condit vmnetdhcp servic run host machin ,Guest OS
geo vision door access control devic famili emploi share cryptograph kei ssh http attack conduct mitm attack deriv kei plaintext recov encrypt messag ,Channel
dvr firmwar tat tat seri product provid tonnet properli verifi patch file attack inject specif command patch file gain access ,Firmware
dvr firmwar tat tat seri product provid tonnet contain misconfigur authent mechan attack crack password gain access ,Firmware
memori corrupt issu address improv memori handl issu fix mac os catalina applic abl execut arbitrari code privileg ,Host OS
issu exist handl racoon configur file issu address improv bound check issu fix os pad os mac os catalina tv os load malici craft racoon configur file lead arbitrari code execut ,Host OS
valid issu address improv input sanit issu fix mac os catalina applic abl read restrict memori ,Host OS
issu address improv permiss logic issu fix os pad os mac os catalina tv os watch os applic abl execut arbitrari code privileg ,Host OS
memori corrupt issu address improv memori handl issu fix os pad os mac os catalina tv os watch os applic abl execut arbitrari code kernel privileg ,Host OS
access issu address improv memori manag issu fix os pad os mac os catalina tv os watch os malici applic abl determin kernel memori layout ,Host OS
valid issu exist handl symlink issu address improv valid symlink issu fix mac os catalina malici applic abl access restrict file ,Host OS
valid issu exist handl symlink issu address improv valid symlink issu fix mac os catalina malici applic abl overwrit arbitrari file ,Host OS
bound read address improv bound check issu fix os pad os mac os catalina tv os watch os applic abl gain elev privileg ,Host OS
memori corrupt issu address improv input valid issu fix mac os catalina view malici craft jpeg file lead arbitrari code execut ,Host OS
us free issu process error notif camx driver properli releas sequenc data snapdragon mobil saipan sm sxr ,Host OS
possibl buffer overflow occur process command firmwar group id obtain firmwar rang snapdragon snapdragon comput snapdragon connect snapdragon consum electron connect snapdragon consum iot snapdragon industri iot snapdragon io snapdragon mobil snapdragon voic music snapdragon wearabl apq apq apq au mdm mdm mdm mdm mdm mdm msm msm msm au qca qca qca sdm sdm sdm sdx sdx sm ,Firmware
firmwar hit wlan firmwar encrypt data length fil reassoc respons byte snapdragon comput snapdragon connect snapdragon consum electron connect snapdragon consum iot snapdragon industri iot snapdragon mobil snapdragon voic music snapdragon wire infrastructur network ipq ipq kamorta nicobar qca qca qcn qc qc qc rennel sc sc sda sdm sdm sdm sdm sm sm sm sxr sxr ,Firmware
possibl bound access process respons video firmwar snapdragon snapdragon comput snapdragon connect snapdragon consum iot snapdragon industri iot snapdragon mobil snapdragon voic music snapdragon wearabl apq apq apq au apq kamorta mdm mdm mdm mdm mdm mdm msm msm msm msm msm au msm nicobar qcm qc qc qm rennel sa sa saipan sc sda sdm sdm sdm sdm sdm sdm sdm sdm sdm sdm sdm sdx sdx sdx sm sm sm sm sxr sxr ,Firmware
vulner hardwar crypto driver cisco io xe softwar cisco seri integr servic router cisco catalyst wireless control allow unauthent remot attack disconnect legitim ip sec vpn session affect devic vulner insuffici verif authent receiv encapsul secur payload esp packet attack exploit vulner tamper esp cleartext valu man middl ,Physical Hardware
vulner ssl implement cisco intellig proxim solut allow unauthent remot attack view alter inform share cisco webex video devic cisco collabor endpoint product meet condit describ vulner product section vulner lack valid ssl server certif receiv establish connect cisco webex video devic cisco collabor endpoint attack exploit vulner man middl mitm techniqu intercept traffic affect client endpoint forg certif imperson endpoint depend configur endpoint exploit allow attack view present content share modifi content present victim access control vulner doe affect cloud regist collabor endpoint ,Channel
